{
  "canonical_digest": "sha256:d848e6d957b69c80a88c40a5846cfb715e7a9551b6465999b2669e685d120f01",
  "cases": [
    {
      "CaseType": "STRUCTURAL_DOCUMENTATION_ORACLE_AND_IMPLEMENTATION_PLAN",
      "DocumentationConformanceStatus": "STRUCTURAL_TRACEABILITY_EXECUTABLE",
      "DocumentationOracleID": "DOC-ORACLE-MAS-001",
      "Environment": "Externally pinned assurance-toolchain and dependency closure appropriate to the declared verification method; package conformance corpus.",
      "EvidenceLocator": "validation/conformance_results.json",
      "ExecutableArtifact": "conformance/requirement_oracles.json#DOC-ORACLE-MAS-001",
      "ExpectedErrorCode": "VECTOR_SPECIFIC",
      "ID": "VC-MAS-001",
      "ImplementationConformanceStatus": "NOT_EXECUTED_PRE_IMPLEMENTATION",
      "Inputs": "Nominal, boundary, stale/replay and negative fixtures specific to MAS-001.",
      "Objective": "Проверить выполнение MAS-001: Master должен формировать PlanProposal из Goal и подписанного ContextProjection, сохраняя альтернативы и основания выбора.",
      "Oracle": "PlanProposal содержит source context root, goal, alternatives и provenance.",
      "OracleType": "STRUCTURAL_TRACEABILITY_ORACLE_AND_FUTURE_IMPLEMENTATION_ORACLE",
      "Owner": "Architecture Board",
      "Preconditions": "Normative model 1.5-rc11, referenced schemas, ADRs (ADR-029;ADR-035;ADR-038) and dependency state (SYS-009) are loaded.",
      "Procedure": "Execute schema test against the exact artifact/transition defined by MOD-MASTER;CTX-MASTER;ART-EXPECTED; capture inputs, digests, receipts and observed state transitions.",
      "RequirementID": "MAS-001",
      "Status": "NOT_EXECUTED_PRE_IMPLEMENTATION"
    },
    {
      "CaseType": "STRUCTURAL_DOCUMENTATION_ORACLE_AND_IMPLEMENTATION_PLAN",
      "DocumentationConformanceStatus": "STRUCTURAL_TRACEABILITY_EXECUTABLE",
      "DocumentationOracleID": "DOC-ORACLE-MAS-002",
      "Environment": "Externally pinned assurance-toolchain and dependency closure appropriate to the declared verification method; package conformance corpus.",
      "EvidenceLocator": "validation/conformance_results.json",
      "ExecutableArtifact": "conformance/requirement_oracles.json#DOC-ORACLE-MAS-002",
      "ExpectedErrorCode": "VECTOR_SPECIFIC",
      "ID": "VC-MAS-002",
      "ImplementationConformanceStatus": "NOT_EXECUTED_PRE_IMPLEMENTATION",
      "Inputs": "Nominal, boundary, stale/replay and negative fixtures specific to MAS-002.",
      "Objective": "Проверить выполнение MAS-002: Master должен формировать и подписывать ExpectedChangePatch, явно маркированный EXPECTED и не являющийся фактом.",
      "Oracle": "Schema и prompt test не допускают отображение EXPECTED в verified-facts section.",
      "OracleType": "STRUCTURAL_TRACEABILITY_ORACLE_AND_FUTURE_IMPLEMENTATION_ORACLE",
      "Owner": "Architecture Board",
      "Preconditions": "Normative model 1.5-rc11, referenced schemas, ADRs (ADR-029;ADR-035;ADR-038) and dependency state (SYS-009) are loaded.",
      "Procedure": "Execute data test against the exact artifact/transition defined by MOD-MASTER;CTX-MASTER;ART-EXPECTED; capture inputs, digests, receipts and observed state transitions.",
      "RequirementID": "MAS-002",
      "Status": "NOT_EXECUTED_PRE_IMPLEMENTATION"
    },
    {
      "CaseType": "STRUCTURAL_DOCUMENTATION_ORACLE_AND_IMPLEMENTATION_PLAN",
      "DocumentationConformanceStatus": "STRUCTURAL_TRACEABILITY_EXECUTABLE",
      "DocumentationOracleID": "DOC-ORACLE-MAS-003",
      "Environment": "Externally pinned assurance-toolchain and dependency closure appropriate to the declared verification method; package conformance corpus.",
      "EvidenceLocator": "validation/conformance_results.json",
      "ExecutableArtifact": "conformance/requirement_oracles.json#DOC-ORACLE-MAS-003",
      "ExpectedErrorCode": "VECTOR_SPECIFIC",
      "ID": "VC-MAS-003",
      "ImplementationConformanceStatus": "NOT_EXECUTED_PRE_IMPLEMENTATION",
      "Inputs": "Nominal, boundary, stale/replay and negative fixtures specific to MAS-003.",
      "Objective": "Проверить выполнение MAS-003: ExpectedChangePatch должен содержать source context dependencies, expected claims, preserved invariants и acceptance intent.",
      "Oracle": "Schema rejects missing required semantic field; examples validate.",
      "OracleType": "STRUCTURAL_TRACEABILITY_ORACLE_AND_FUTURE_IMPLEMENTATION_ORACLE",
      "Owner": "Architecture Board",
      "Preconditions": "Normative model 1.5-rc11, referenced schemas, ADRs (ADR-029;ADR-035;ADR-038) and dependency state (SYS-009) are loaded.",
      "Procedure": "Execute audit test against the exact artifact/transition defined by MOD-MASTER;CTX-MASTER;ART-EXPECTED; capture inputs, digests, receipts and observed state transitions.",
      "RequirementID": "MAS-003",
      "Status": "NOT_EXECUTED_PRE_IMPLEMENTATION"
    },
    {
      "CaseType": "STRUCTURAL_DOCUMENTATION_ORACLE_AND_IMPLEMENTATION_PLAN",
      "DocumentationConformanceStatus": "STRUCTURAL_TRACEABILITY_EXECUTABLE",
      "DocumentationOracleID": "DOC-ORACLE-MAS-004",
      "Environment": "Externally pinned assurance-toolchain and dependency closure appropriate to the declared verification method; package conformance corpus.",
      "EvidenceLocator": "validation/conformance_results.json",
      "ExecutableArtifact": "conformance/requirement_oracles.json#DOC-ORACLE-MAS-004",
      "ExpectedErrorCode": "VECTOR_SPECIFIC",
      "ID": "VC-MAS-004",
      "ImplementationConformanceStatus": "NOT_EXECUTED_PRE_IMPLEMENTATION",
      "Inputs": "Nominal, boundary, stale/replay and negative fixtures specific to MAS-004.",
      "Objective": "Проверить выполнение MAS-004: Master должен ранжировать PlanProposal как RECOMMENDED, RISKY, DISCOURAGED или UNKNOWN без создания authority.",
      "Oracle": "Assessment не содержит Permit и не принимается GateKernel как authority artifact.",
      "OracleType": "STRUCTURAL_TRACEABILITY_ORACLE_AND_FUTURE_IMPLEMENTATION_ORACLE",
      "Owner": "Architecture Board",
      "Preconditions": "Normative model 1.5-rc11, referenced schemas, ADRs (ADR-029;ADR-035;ADR-038) and dependency state (SYS-009) are loaded.",
      "Procedure": "Execute functional test against the exact artifact/transition defined by MOD-MASTER;CTX-MASTER;ART-EXPECTED; capture inputs, digests, receipts and observed state transitions.",
      "RequirementID": "MAS-004",
      "Status": "NOT_EXECUTED_PRE_IMPLEMENTATION"
    },
    {
      "CaseType": "STRUCTURAL_DOCUMENTATION_ORACLE_AND_IMPLEMENTATION_PLAN",
      "DocumentationConformanceStatus": "STRUCTURAL_TRACEABILITY_EXECUTABLE",
      "DocumentationOracleID": "DOC-ORACLE-MAS-005",
      "Environment": "Externally pinned assurance-toolchain and dependency closure appropriate to the declared verification method; package conformance corpus.",
      "EvidenceLocator": "validation/conformance_results.json",
      "ExecutableArtifact": "conformance/requirement_oracles.json#DOC-ORACLE-MAS-005",
      "ExpectedErrorCode": "VECTOR_SPECIFIC",
      "ID": "VC-MAS-005",
      "ImplementationConformanceStatus": "NOT_EXECUTED_PRE_IMPLEMENTATION",
      "Inputs": "Nominal, boundary, stale/replay and negative fixtures specific to MAS-005.",
      "Objective": "Проверить выполнение MAS-005: Master должен отдельно оценивать порядок шагов, достижимость цели, риски траектории и необходимость replanning.",
      "Oracle": "TrajectoryAssessment содержит отдельные поля и тесты конфликтных случаев.",
      "OracleType": "STRUCTURAL_TRACEABILITY_ORACLE_AND_FUTURE_IMPLEMENTATION_ORACLE",
      "Owner": "Architecture Board",
      "Preconditions": "Normative model 1.5-rc11, referenced schemas, ADRs (ADR-029;ADR-035;ADR-038) and dependency state (SYS-009) are loaded.",
      "Procedure": "Execute analytical test against the exact artifact/transition defined by MOD-MASTER;CTX-MASTER;ART-EXPECTED; capture inputs, digests, receipts and observed state transitions.",
      "RequirementID": "MAS-005",
      "Status": "NOT_EXECUTED_PRE_IMPLEMENTATION"
    },
    {
      "CaseType": "STRUCTURAL_DOCUMENTATION_ORACLE_AND_IMPLEMENTATION_PLAN",
      "DocumentationConformanceStatus": "STRUCTURAL_TRACEABILITY_EXECUTABLE",
      "DocumentationOracleID": "DOC-ORACLE-MAS-006",
      "Environment": "Externally pinned assurance-toolchain and dependency closure appropriate to the declared verification method; package conformance corpus.",
      "EvidenceLocator": "validation/conformance_results.json",
      "ExecutableArtifact": "conformance/requirement_oracles.json#DOC-ORACLE-MAS-006",
      "ExpectedErrorCode": "VECTOR_SPECIFIC",
      "ID": "VC-MAS-006",
      "ImplementationConformanceStatus": "NOT_EXECUTED_PRE_IMPLEMENTATION",
      "Inputs": "Nominal, boundary, stale/replay and negative fixtures specific to MAS-006.",
      "Objective": "Проверить выполнение MAS-006: Каждое аналитическое утверждение Master должно содержать evidence level, uncertainty и provenance.",
      "Oracle": "Schema/review обнаруживает ноль безуровневых статистических claims.",
      "OracleType": "STRUCTURAL_TRACEABILITY_ORACLE_AND_FUTURE_IMPLEMENTATION_ORACLE",
      "Owner": "Architecture Board",
      "Preconditions": "Normative model 1.5-rc11, referenced schemas, ADRs (ADR-029;ADR-035;ADR-038) and dependency state (SYS-009) are loaded.",
      "Procedure": "Execute analytical review against the exact artifact/transition defined by MOD-MASTER;CTX-MASTER;ART-EXPECTED; capture inputs, digests, receipts and observed state transitions.",
      "RequirementID": "MAS-006",
      "Status": "NOT_EXECUTED_PRE_IMPLEMENTATION"
    },
    {
      "CaseType": "STRUCTURAL_DOCUMENTATION_ORACLE_AND_IMPLEMENTATION_PLAN",
      "DocumentationConformanceStatus": "STRUCTURAL_TRACEABILITY_EXECUTABLE",
      "DocumentationOracleID": "DOC-ORACLE-MAS-007",
      "Environment": "Externally pinned assurance-toolchain and dependency closure appropriate to the declared verification method; package conformance corpus.",